{
  "name": "Ranchu 9745_1",
  "description": "https://luckycoinvn.vercel.app",
  "image": "https://drive.google.com/uc?export=view&id=126I4GjZ-Ddo97eGNOkDMm_jzauFtfP8w",
  "attributes": [
    { "trait_type": "Rarity", "value": "Legendary" },
    { "trait_type": "Version", "value": "Genesis" }
  ]
}
